{
  "name": "Upload Nginx Configuration Fil",
  "description": "Upload nginx-configuration-fil",
  "execute_on": "ve",
  "skip_if_all_missing": [
    "upload_nginx_configuration_fil_content"
  ],
  "parameters": [
    {
      "id": "upload_nginx_configuration_fil_content",
      "name": "Nginx Configuration Fil",
      "type": "string",
      "upload": true,
      "required": true,
      "advanced": false,
      "description": "Configuration file: Nginx Configuration Fil"
    },
    {
      "id": "upload_nginx_configuration_fil_destination",
      "name": "Destination Path",
      "type": "string",
      "default": "conf:nginx.conf",
      "advanced": true,
      "description": "Target path: {volume_key}:{filename}"
    },
    {
      "id": "shared_volpath",
      "name": "Shared Volume Path",
      "type": "string",
      "advanced": true,
      "description": "Path to the shared volume mount point"
    },
    {
      "id": "hostname",
      "name": "Hostname",
      "type": "string",
      "required": true,
      "description": "Container hostname"
    },
    {
      "id": "uid",
      "name": "UID",
      "type": "string",
      "default": "0",
      "advanced": true,
      "description": "User ID for file ownership"
    },
    {
      "id": "gid",
      "name": "GID",
      "type": "string",
      "default": "0",
      "advanced": true,
      "description": "Group ID for file ownership"
    },
    {
      "id": "mapped_uid",
      "name": "Mapped UID",
      "type": "string",
      "default": "",
      "advanced": true,
      "description": "Mapped user ID for unprivileged containers"
    },
    {
      "id": "mapped_gid",
      "name": "Mapped GID",
      "type": "string",
      "default": "",
      "advanced": true,
      "description": "Mapped group ID for unprivileged containers"
    }
  ],
  "commands": [
    {
      "name": "Upload Nginx Configuration Fil",
      "script": "0-upload-nginx-configuration-fil.sh",
      "library": "upload-file-common.sh",
      "outputs": [
        "upload_nginx_configuration_fil_uploaded"
      ]
    }
  ]
}