{
  "name": "Setup ACME Cloudflare",
  "description": "Install acme.sh and issue a Let's Encrypt wildcard certificate via Cloudflare DNS-01",
  "execute_on": "lxc",
  "skip_if_all_missing": ["CF_TOKEN", "CF_ZONE_ID"],
  "parameters": [
    {
      "id": "CF_TOKEN",
      "name": "Cloudflare API Token",
      "type": "string",
      "required": true,
      "description": "Cloudflare API Token with Zone:DNS:Edit permission"
    },
    {
      "id": "CF_ZONE_ID",
      "name": "Cloudflare Zone ID",
      "type": "string",
      "required": true,
      "description": "Cloudflare Zone ID for the domain"
    },
    {
      "id": "acme_domain",
      "name": "ACME Domain",
      "type": "string",
      "default": "",
      "advanced": true,
      "description": "Domain for wildcard cert (e.g. ohnewarum.de). Defaults to domain_suffix without leading dot."
    },
    {
      "id": "domain_suffix",
      "name": "Domain Suffix",
      "type": "string",
      "advanced": true,
      "description": "Domain suffix (e.g. .ohnewarum.de)"
    }
  ],
  "commands": [
    {
      "script": "post-setup-acme-cloudflare.sh",
      "description": "Install acme.sh, issue wildcard cert, deploy to /etc/ssl/addon/"
    }
  ]
}
