{
  "execute_on": "ve",
  "name": "Set Parameters",
  "description": "Set application-specific parameters for Proxvex",
  "parameters": [],
  "commands": [
    {
      "name": "set-properties",
      "properties": [
        {
          "id": "hostname",
          "value": "proxvex"
        },
        {
          "id": "oci_image",
          "value": "ghcr.io/proxvex/proxvex"
        },
        {
          "id": "uid",
          "value": "0"
        },
        {
          "id": "username",
          "value": "root"
        },
        {
          "id": "volumes",
          "value": "config=/config\ndata=/data\nssl=/ssl"
        }
      ]
    }
  ]
}