{
  "name": "Enable SSL App Configuration",
  "description": "Application-specific SSL setup when the SSL addon is enabled. The default shared script is a no-op. Applications can override conf-enable-ssl-app.sh in their own scripts/ directory.",
  "execute_on": "ve",
  "parameters": [
    {
      "id": "shared_volpath",
      "name": "Shared Volume Path",
      "type": "string",
      "advanced": true,
      "description": "Path to the shared volume mount point"
    },
    {
      "id": "hostname",
      "name": "Hostname",
      "type": "string",
      "required": true,
      "description": "Container hostname"
    },
    {
      "id": "uid",
      "name": "UID",
      "type": "string",
      "default": "0",
      "advanced": true,
      "description": "User ID for file ownership"
    },
    {
      "id": "gid",
      "name": "GID",
      "type": "string",
      "default": "0",
      "advanced": true,
      "description": "Group ID for file ownership"
    },
    {
      "id": "mapped_uid",
      "name": "Mapped UID",
      "type": "string",
      "default": "",
      "advanced": true,
      "description": "Mapped user ID for unprivileged containers"
    },
    {
      "id": "mapped_gid",
      "name": "Mapped GID",
      "type": "string",
      "default": "",
      "advanced": true,
      "description": "Mapped group ID for unprivileged containers"
    }
  ],
  "commands": [
    {
      "name": "Enable SSL App Configuration",
      "script": "conf-enable-ssl-app.sh",
      "outputs": ["ssl_app_enabled", "env_file", "compose_file"]
    }
  ]
}
